{
  "$schema": "https://raw.githubusercontent.com/liangboqiang/TjuaeHub/main/schemas/official-asset-provenance.v1.schema.json",
  "schemaVersion": 1,
  "sourceRepository": "https://github.com/liangboqiang/TjuaeCore/",
  "sourceRevision": "76d6391a41c88641cb7adebd5c33590f6ec59335",
  "packages": [
    {
      "packageName": "tjuaeasset-assistant-academic-paper",
      "assetKind": "assistant",
      "originKind": "repositorySnapshot",
      "runtimeId": "academic-paper",
      "hubSourcePath": "assets/tjuaeasset-assistant-academic-paper",
      "sourcePath": "crates/tjuaeui-app/assets/builtin-assistants",
      "sourceObject": "6593540b1fe35c743c2976edcfb57e8f665ecd37",
      "excludedOverlayFields": [
        "agent_ref",
        "custom_skill_names",
        "default_enabled",
        "disabled_builtin_skills",
        "models",
        "sort_order"
      ],
      "transformations": [
        "将 enabled_skills 从 Core 本地运行时 ID 映射为 Hub 稳定远程资产 ID。",
        "将多语言规则文件收敛为包内 rules/<locale>.md。",
        "不复制来源未单独证明的旧位图头像，改用包内定义的 Unicode 符号。"
      ]
    },
    {
      "packageName": "tjuaeasset-assistant-beautiful-mermaid",
      "assetKind": "assistant",
      "originKind": "repositorySnapshot",
      "runtimeId": "beautiful-mermaid",
      "hubSourcePath": "assets/tjuaeasset-assistant-beautiful-mermaid",
      "sourcePath": "crates/tjuaeui-app/assets/builtin-assistants",
      "sourceObject": "6593540b1fe35c743c2976edcfb57e8f665ecd37",
      "excludedOverlayFields": [
        "agent_ref",
        "custom_skill_names",
        "default_enabled",
        "disabled_builtin_skills",
        "models",
        "sort_order"
      ],
      "transformations": [
        "将 enabled_skills 从 Core 本地运行时 ID 映射为 Hub 稳定远程资产 ID。",
        "将多语言规则文件收敛为包内 rules/<locale>.md。",
        "不复制来源未单独证明的旧位图头像，改用包内定义的 Unicode 符号。"
      ]
    },
    {
      "packageName": "tjuaeasset-assistant-dashboard-creator",
      "assetKind": "assistant",
      "originKind": "repositorySnapshot",
      "runtimeId": "dashboard-creator",
      "hubSourcePath": "assets/tjuaeasset-assistant-dashboard-creator",
      "sourcePath": "crates/tjuaeui-app/assets/builtin-assistants",
      "sourceObject": "6593540b1fe35c743c2976edcfb57e8f665ecd37",
      "excludedOverlayFields": [
        "agent_ref",
        "custom_skill_names",
        "default_enabled",
        "disabled_builtin_skills",
        "models",
        "sort_order"
      ],
      "transformations": [
        "将 enabled_skills 从 Core 本地运行时 ID 映射为 Hub 稳定远程资产 ID。",
        "将多语言规则文件收敛为包内 rules/<locale>.md。",
        "不复制来源未单独证明的旧位图头像，改用包内定义的 Unicode 符号。"
      ]
    },
    {
      "packageName": "tjuaeasset-assistant-excel-creator",
      "assetKind": "assistant",
      "originKind": "repositorySnapshot",
      "runtimeId": "excel-creator",
      "hubSourcePath": "assets/tjuaeasset-assistant-excel-creator",
      "sourcePath": "crates/tjuaeui-app/assets/builtin-assistants",
      "sourceObject": "6593540b1fe35c743c2976edcfb57e8f665ecd37",
      "excludedOverlayFields": [
        "agent_ref",
        "custom_skill_names",
        "default_enabled",
        "disabled_builtin_skills",
        "models",
        "sort_order"
      ],
      "transformations": [
        "将 enabled_skills 从 Core 本地运行时 ID 映射为 Hub 稳定远程资产 ID。",
        "将多语言规则文件收敛为包内 rules/<locale>.md。",
        "不复制来源未单独证明的旧位图头像，改用包内定义的 Unicode 符号。"
      ]
    },
    {
      "packageName": "tjuaeasset-assistant-financial-model-creator",
      "assetKind": "assistant",
      "originKind": "repositorySnapshot",
      "runtimeId": "financial-model-creator",
      "hubSourcePath": "assets/tjuaeasset-assistant-financial-model-creator",
      "sourcePath": "crates/tjuaeui-app/assets/builtin-assistants",
      "sourceObject": "6593540b1fe35c743c2976edcfb57e8f665ecd37",
      "excludedOverlayFields": [
        "agent_ref",
        "custom_skill_names",
        "default_enabled",
        "disabled_builtin_skills",
        "models",
        "sort_order"
      ],
      "transformations": [
        "将 enabled_skills 从 Core 本地运行时 ID 映射为 Hub 稳定远程资产 ID。",
        "将多语言规则文件收敛为包内 rules/<locale>.md。",
        "不复制来源未单独证明的旧位图头像，改用包内定义的 Unicode 符号。"
      ]
    },
    {
      "packageName": "tjuaeasset-assistant-pitch-deck-creator",
      "assetKind": "assistant",
      "originKind": "repositorySnapshot",
      "runtimeId": "pitch-deck-creator",
      "hubSourcePath": "assets/tjuaeasset-assistant-pitch-deck-creator",
      "sourcePath": "crates/tjuaeui-app/assets/builtin-assistants",
      "sourceObject": "6593540b1fe35c743c2976edcfb57e8f665ecd37",
      "excludedOverlayFields": [
        "agent_ref",
        "custom_skill_names",
        "default_enabled",
        "disabled_builtin_skills",
        "models",
        "sort_order"
      ],
      "transformations": [
        "将 enabled_skills 从 Core 本地运行时 ID 映射为 Hub 稳定远程资产 ID。",
        "将多语言规则文件收敛为包内 rules/<locale>.md。",
        "不复制来源未单独证明的旧位图头像，改用包内定义的 Unicode 符号。"
      ]
    },
    {
      "packageName": "tjuaeasset-assistant-ppt-creator",
      "assetKind": "assistant",
      "originKind": "repositorySnapshot",
      "runtimeId": "ppt-creator",
      "hubSourcePath": "assets/tjuaeasset-assistant-ppt-creator",
      "sourcePath": "crates/tjuaeui-app/assets/builtin-assistants",
      "sourceObject": "6593540b1fe35c743c2976edcfb57e8f665ecd37",
      "excludedOverlayFields": [
        "agent_ref",
        "custom_skill_names",
        "default_enabled",
        "disabled_builtin_skills",
        "models",
        "sort_order"
      ],
      "transformations": [
        "将 enabled_skills 从 Core 本地运行时 ID 映射为 Hub 稳定远程资产 ID。",
        "将多语言规则文件收敛为包内 rules/<locale>.md。",
        "不复制来源未单独证明的旧位图头像，改用包内定义的 Unicode 符号。"
      ]
    },
    {
      "packageName": "tjuaeasset-assistant-word-creator",
      "assetKind": "assistant",
      "originKind": "repositorySnapshot",
      "runtimeId": "word-creator",
      "hubSourcePath": "assets/tjuaeasset-assistant-word-creator",
      "sourcePath": "crates/tjuaeui-app/assets/builtin-assistants",
      "sourceObject": "6593540b1fe35c743c2976edcfb57e8f665ecd37",
      "excludedOverlayFields": [
        "agent_ref",
        "custom_skill_names",
        "default_enabled",
        "disabled_builtin_skills",
        "models",
        "sort_order"
      ],
      "transformations": [
        "将 enabled_skills 从 Core 本地运行时 ID 映射为 Hub 稳定远程资产 ID。",
        "将多语言规则文件收敛为包内 rules/<locale>.md。",
        "不复制来源未单独证明的旧位图头像，改用包内定义的 Unicode 符号。"
      ]
    },
    {
      "packageName": "tjuaeasset-assistant-word-form-creator",
      "assetKind": "assistant",
      "originKind": "repositorySnapshot",
      "runtimeId": "word-form-creator",
      "hubSourcePath": "assets/tjuaeasset-assistant-word-form-creator",
      "sourcePath": "crates/tjuaeui-app/assets/builtin-assistants",
      "sourceObject": "6593540b1fe35c743c2976edcfb57e8f665ecd37",
      "excludedOverlayFields": [
        "agent_ref",
        "custom_skill_names",
        "default_enabled",
        "disabled_builtin_skills",
        "models",
        "sort_order"
      ],
      "transformations": [
        "将 enabled_skills 从 Core 本地运行时 ID 映射为 Hub 稳定远程资产 ID。",
        "将多语言规则文件收敛为包内 rules/<locale>.md。",
        "不复制来源未单独证明的旧位图头像，改用包内定义的 Unicode 符号。"
      ]
    },
    {
      "packageName": "tjuaeasset-codex",
      "assetKind": "engineAdapter",
      "originKind": "repositorySnapshot",
      "runtimeId": "codex",
      "hubSourcePath": "assets/tjuaeasset-codex",
      "sourcePath": "crates/tjuaeui-db/migrations/020_update_codex_acp_package_scope.sql",
      "sourceObject": "511b0fdf24d1b69fd8c5957f2b59806678c43305",
      "excludedOverlayFields": [],
      "transformations": [
        "将旧运行表中的 Codex ACP 启动信息收敛为固定版本、纯声明的 engine-adapter.json。",
        "不迁移本机可执行路径、账号、环境变量和启用状态。"
      ]
    },
    {
      "packageName": "tjuaeasset-mcp-everything",
      "assetKind": "mcp",
      "originKind": "repositorySnapshot",
      "runtimeId": "mcp-everything",
      "hubSourcePath": "assets/tjuaeasset-mcp-everything",
      "sourcePath": "crates/tjuaeui-mcp/tests/types_integration.rs",
      "sourceObject": "48d1e9365bceb2ef2b8d6f0bcc4f6ea5c1032921",
      "excludedOverlayFields": [],
      "transformations": [
        "将 MCP Everything 的测试配置收敛为固定版本、纯声明的 mcp.json。",
        "不迁移本机命令路径、环境变量、请求头、实例 URL 和启用状态。"
      ]
    },
    {
      "packageName": "tjuaeasset-skill-cron",
      "assetKind": "skill",
      "originKind": "repositorySnapshot",
      "runtimeId": "cron",
      "hubSourcePath": "assets/tjuaeasset-skill-cron",
      "sourcePath": "crates/tjuaeui-app/assets/builtin-skills/auto-inject/cron",
      "sourceObject": "0c28f1cda7cf1ba54ad953b800017c66ddef3e05",
      "excludedOverlayFields": [],
      "transformations": []
    },
    {
      "packageName": "tjuaeasset-skill-mermaid",
      "assetKind": "skill",
      "originKind": "repositorySnapshot",
      "runtimeId": "mermaid",
      "hubSourcePath": "assets/tjuaeasset-skill-mermaid",
      "sourcePath": "crates/tjuaeui-app/assets/builtin-skills/mermaid",
      "sourceObject": "67edd1af89edc6c3e7bddfbc65e806ff7909fb0f",
      "excludedOverlayFields": [],
      "transformations": [
        "将 tsx 固定为 npm 版本 4.23.1，并由 package-lock.json 锁定完整依赖完整性。",
        "将 beautiful-mermaid 固定为 npm 版本 1.1.3，并由 package-lock.json 锁定完整依赖完整性。",
        "移除运行时自动安装和依赖 PATH 中可变 npx 的脚本 shebang。"
      ]
    },
    {
      "packageName": "tjuaeasset-skill-tjuaeui-config",
      "assetKind": "skill",
      "originKind": "repositorySnapshot",
      "runtimeId": "tjuaeui-config",
      "hubSourcePath": "assets/tjuaeasset-skill-tjuaeui-config",
      "sourcePath": "crates/tjuaeui-app/assets/builtin-skills/auto-inject/tjuaeui-config",
      "sourceObject": "69916d6c15d4fd2d7ee2a6ca27d971603c0ccb83",
      "excludedOverlayFields": [],
      "transformations": []
    },
    {
      "packageName": "tjuaeasset-skill-tjuaeui-troubleshooting",
      "assetKind": "skill",
      "originKind": "repositorySnapshot",